product_id,name,category,subcategory,price,stock,initial_rating,added_date,description
514,HP Accessoires Souris Standard,Accessoires,Souris,116.07,450,4.5,2025-01-24 10:25:45.743084,Polyvalent HP Accessoires Souris Standard. Interface intuitive. Idéal pour souris. Catégorie Accessoires.
515,Lenovo Ordinateurs Workstation Lite,Ordinateurs,Workstation,2284.73,413,3.6,2025-01-10 10:25:45.743084,Puissant Lenovo Ordinateurs Workstation Lite. Design moderne. Idéal pour workstation. Catégorie Ordinateurs.
516,LG Ordinateurs Laptop Pro,Ordinateurs,Laptop,575.35,85,3.6,2025-08-28 10:25:45.743084,Polyvalent LG Ordinateurs Laptop Pro. Design moderne. Idéal pour laptop. Catégorie Ordinateurs.
517,Sony Audio Écouteurs Plus,Audio,Écouteurs,166.54,435,4.6,2023-12-12 10:25:45.743084,Performant Sony Audio Écouteurs Plus. Longue autonomie. Idéal pour écouteurs. Catégorie Audio.
518,Acer Tablettes iPad Lite,Tablettes,iPad,788.95,96,3.5,2024-05-29 10:25:45.743084,Élégant Acer Tablettes iPad Lite. Haute performance. Idéal pour ipad. Catégorie Tablettes.
519,LG Gaming Jeux Standard,Gaming,Jeux,843.26,408,4.4,2024-04-16 10:25:45.743084,Puissant LG Gaming Jeux Standard. Haute performance. Idéal pour jeux. Catégorie Gaming.
520,Sony Wearables Bracelet Connecté Standard,Wearables,Bracelet Connecté,642.52,435,4.8,2024-08-10 10:25:45.743084,Performant Sony Wearables Bracelet Connecté Standard. Longue autonomie. Idéal pour bracelet connecté. Catégorie Wearables.
521,HP Ordinateurs Workstation Plus,Ordinateurs,Workstation,2129.13,314,4.1,2024-03-23 10:25:45.743084,Révolutionnaire HP Ordinateurs Workstation Plus. Longue autonomie. Idéal pour workstation. Catégorie Ordinateurs.
522,Samsung Photo Stabilisateur Standard,Photo,Stabilisateur,1401.69,29,3.6,2023-12-04 10:25:45.743084,Puissant Samsung Photo Stabilisateur Standard. Longue autonomie. Idéal pour stabilisateur. Catégorie Photo.
523,Xiaomi Accessoires Souris Pro,Accessoires,Souris,37.73,100,4.6,2024-07-26 10:25:45.743084,Puissant Xiaomi Accessoires Souris Pro. Interface intuitive. Idéal pour souris. Catégorie Accessoires.
524,Acer Ordinateurs Desktop Standard,Ordinateurs,Desktop,2072.62,66,4.9,2024-08-15 10:25:45.743084,Compact Acer Ordinateurs Desktop Standard. Connectivité avancée. Idéal pour desktop. Catégorie Ordinateurs.
525,Xiaomi Audio Soundbar Max,Audio,Soundbar,241.72,387,4.6,2025-09-09 10:25:45.743084,Révolutionnaire Xiaomi Audio Soundbar Max. Haute performance. Idéal pour soundbar. Catégorie Audio.
526,Asus Audio Enceinte Pro,Audio,Enceinte,109.41,348,4.4,2025-05-21 10:25:45.743084,Révolutionnaire Asus Audio Enceinte Pro. Longue autonomie. Idéal pour enceinte. Catégorie Audio.
527,Xiaomi Accessoires Cable Plus,Accessoires,Cable,72.01,440,3.8,2024-05-03 10:25:45.743084,Révolutionnaire Xiaomi Accessoires Cable Plus. Longue autonomie. Idéal pour cable. Catégorie Accessoires.
528,Dell Smart Home Thermostat Lite,Smart Home,Thermostat,186.37,62,3.5,2025-08-25 10:25:45.743084,Performant Dell Smart Home Thermostat Lite. Connectivité avancée. Idéal pour thermostat. Catégorie Smart Home.
529,Samsung Accessoires Cable Standard,Accessoires,Cable,30.55,31,4.5,2023-12-18 10:25:45.743084,Puissant Samsung Accessoires Cable Standard. Longue autonomie. Idéal pour cable. Catégorie Accessoires.
530,Samsung Composants RAM Standard,Composants,RAM,1116.47,86,3.8,2025-03-16 10:25:45.743084,Compact Samsung Composants RAM Standard. Design moderne. Idéal pour ram. Catégorie Composants.
531,LG Accessoires Souris Max,Accessoires,Souris,155.09,210,4.8,2023-11-25 10:25:45.743084,Innovant LG Accessoires Souris Max. Interface intuitive. Idéal pour souris. Catégorie Accessoires.
532,Xiaomi Ordinateurs Ultrabook Pro,Ordinateurs,Ultrabook,1938.67,462,4.2,2023-12-31 10:25:45.743084,Innovant Xiaomi Ordinateurs Ultrabook Pro. Longue autonomie. Idéal pour ultrabook. Catégorie Ordinateurs.
533,Samsung Accessoires Housse Plus,Accessoires,Housse,167.0,50,4.3,2024-01-29 10:25:45.743084,Premium Samsung Accessoires Housse Plus. Connectivité avancée. Idéal pour housse. Catégorie Accessoires.
534,Lenovo Smartphones Feature Phone Standard,Smartphones,Feature Phone,365.84,62,4.6,2024-09-21 10:25:45.743084,Innovant Lenovo Smartphones Feature Phone Standard. Longue autonomie. Idéal pour feature phone. Catégorie Smartphones.
535,Apple Audio Casque Bluetooth Plus,Audio,Casque Bluetooth,234.74,79,4.7,2025-07-13 10:25:45.743084,Premium Apple Audio Casque Bluetooth Plus. Design moderne. Idéal pour casque bluetooth. Catégorie Audio.
536,Lenovo Photo Objectif Lite,Photo,Objectif,3164.25,342,4.5,2024-09-05 10:25:45.743084,Innovant Lenovo Photo Objectif Lite. Longue autonomie. Idéal pour objectif. Catégorie Photo.
537,Asus Accessoires Housse Max,Accessoires,Housse,138.44,231,4.9,2024-01-09 10:25:45.743084,Élégant Asus Accessoires Housse Max. Connectivité avancée. Idéal pour housse. Catégorie Accessoires.
538,LG Ordinateurs Workstation Standard,Ordinateurs,Workstation,2239.47,365,5.0,2024-12-25 10:25:45.743084,Polyvalent LG Ordinateurs Workstation Standard. Connectivité avancée. Idéal pour workstation. Catégorie Ordinateurs.
539,Acer Accessoires Souris Lite,Accessoires,Souris,148.5,100,4.9,2024-11-11 10:25:45.743084,Premium Acer Accessoires Souris Lite. Haute performance. Idéal pour souris. Catégorie Accessoires.
540,HP Ordinateurs Laptop Plus,Ordinateurs,Laptop,2128.57,128,4.7,2025-09-22 10:25:45.743084,Puissant HP Ordinateurs Laptop Plus. Longue autonomie. Idéal pour laptop. Catégorie Ordinateurs.
541,Sony Photo Appareil Photo Max,Photo,Appareil Photo,742.87,18,4.6,2025-09-08 10:25:45.743084,Révolutionnaire Sony Photo Appareil Photo Max. Interface intuitive. Idéal pour appareil photo. Catégorie Photo.
542,Acer Gaming Jeux Max,Gaming,Jeux,1451.55,356,4.5,2024-02-05 10:25:45.743084,Premium Acer Gaming Jeux Max. Longue autonomie. Idéal pour jeux. Catégorie Gaming.
543,LG Smart Home Éclairage Max,Smart Home,Éclairage,376.15,418,3.7,2024-12-15 10:25:45.743084,Élégant LG Smart Home Éclairage Max. Interface intuitive. Idéal pour éclairage. Catégorie Smart Home.
544,Samsung Ordinateurs Desktop Standard,Ordinateurs,Desktop,2983.7,446,3.9,2024-03-27 10:25:45.743084,Innovant Samsung Ordinateurs Desktop Standard. Connectivité avancée. Idéal pour desktop. Catégorie Ordinateurs.
545,Apple Accessoires Cable Standard,Accessoires,Cable,141.74,93,3.5,2024-07-03 10:25:45.743084,Polyvalent Apple Accessoires Cable Standard. Connectivité avancée. Idéal pour cable. Catégorie Accessoires.
546,Asus Audio Casque Bluetooth Lite,Audio,Casque Bluetooth,352.81,80,3.7,2024-02-27 10:25:45.743084,Innovant Asus Audio Casque Bluetooth Lite. Longue autonomie. Idéal pour casque bluetooth. Catégorie Audio.
547,Lenovo Smart Home Thermostat Max,Smart Home,Thermostat,281.67,102,4.2,2025-06-11 10:25:45.743084,Compact Lenovo Smart Home Thermostat Max. Design moderne. Idéal pour thermostat. Catégorie Smart Home.
548,Apple Audio Soundbar Max,Audio,Soundbar,437.92,368,3.7,2025-03-31 10:25:45.743084,Polyvalent Apple Audio Soundbar Max. Haute performance. Idéal pour soundbar. Catégorie Audio.
549,Asus Ordinateurs Laptop Pro,Ordinateurs,Laptop,2992.09,153,4.9,2024-03-07 10:25:45.743084,Innovant Asus Ordinateurs Laptop Pro. Longue autonomie. Idéal pour laptop. Catégorie Ordinateurs.
550,Apple Accessoires Cable Standard,Accessoires,Cable,158.02,268,4.7,2025-04-22 10:25:45.743084,Performant Apple Accessoires Cable Standard. Design moderne. Idéal pour cable. Catégorie Accessoires.
551,Sony Audio Casque Bluetooth Pro,Audio,Casque Bluetooth,317.88,117,3.6,2025-09-15 10:25:45.743084,Innovant Sony Audio Casque Bluetooth Pro. Design moderne. Idéal pour casque bluetooth. Catégorie Audio.
552,Dell Photo Appareil Photo Pro,Photo,Appareil Photo,671.09,341,3.9,2025-06-21 10:25:45.743084,Polyvalent Dell Photo Appareil Photo Pro. Haute performance. Idéal pour appareil photo. Catégorie Photo.
553,HP Wearables Bracelet Connecté Lite,Wearables,Bracelet Connecté,608.72,493,4.7,2025-04-25 10:25:45.743084,Premium HP Wearables Bracelet Connecté Lite. Design moderne. Idéal pour bracelet connecté. Catégorie Wearables.
554,Acer Smartphones Feature Phone Lite,Smartphones,Feature Phone,1121.13,278,4.7,2024-07-19 10:25:45.743084,Puissant Acer Smartphones Feature Phone Lite. Connectivité avancée. Idéal pour feature phone. Catégorie Smartphones.
555,Sony Smart Home Thermostat Lite,Smart Home,Thermostat,399.01,491,4.9,2025-03-27 10:25:45.743084,Puissant Sony Smart Home Thermostat Lite. Design moderne. Idéal pour thermostat. Catégorie Smart Home.
556,LG Ordinateurs Laptop Lite,Ordinateurs,Laptop,811.39,362,5.0,2024-02-05 10:25:45.743084,Compact LG Ordinateurs Laptop Lite. Haute performance. Idéal pour laptop. Catégorie Ordinateurs.
557,LG Composants SSD Standard,Composants,SSD,1324.78,224,5.0,2024-07-05 10:25:45.743084,Révolutionnaire LG Composants SSD Standard. Design moderne. Idéal pour ssd. Catégorie Composants.
558,HP Gaming PC Gaming Plus,Gaming,PC Gaming,732.3,474,4.1,2025-07-11 10:25:45.743084,Compact HP Gaming PC Gaming Plus. Longue autonomie. Idéal pour pc gaming. Catégorie Gaming.
559,Xiaomi Photo Drone Plus,Photo,Drone,3873.27,418,3.9,2024-03-09 10:25:45.743084,Innovant Xiaomi Photo Drone Plus. Connectivité avancée. Idéal pour drone. Catégorie Photo.
560,HP Photo Appareil Photo Standard,Photo,Appareil Photo,1429.76,267,4.6,2024-09-20 10:25:45.743084,Innovant HP Photo Appareil Photo Standard. Connectivité avancée. Idéal pour appareil photo. Catégorie Photo.
561,LG Ordinateurs Workstation Max,Ordinateurs,Workstation,2209.95,136,3.9,2024-10-07 10:25:45.743084,Élégant LG Ordinateurs Workstation Max. Connectivité avancée. Idéal pour workstation. Catégorie Ordinateurs.
562,LG Ordinateurs Desktop Plus,Ordinateurs,Desktop,1237.48,225,4.7,2025-06-25 10:25:45.743084,Performant LG Ordinateurs Desktop Plus. Haute performance. Idéal pour desktop. Catégorie Ordinateurs.
563,Dell Ordinateurs Workstation Plus,Ordinateurs,Workstation,522.49,333,4.3,2024-12-08 10:25:45.743084,Premium Dell Ordinateurs Workstation Plus. Connectivité avancée. Idéal pour workstation. Catégorie Ordinateurs.
564,Lenovo Ordinateurs Workstation Pro,Ordinateurs,Workstation,2083.39,228,4.7,2024-07-03 10:25:45.743084,Puissant Lenovo Ordinateurs Workstation Pro. Longue autonomie. Idéal pour workstation. Catégorie Ordinateurs.
565,Samsung Accessoires Casque Pro,Accessoires,Casque,31.52,322,3.9,2025-01-11 10:25:45.743084,Polyvalent Samsung Accessoires Casque Pro. Interface intuitive. Idéal pour casque. Catégorie Accessoires.
566,Lenovo Smartphones Feature Phone Lite,Smartphones,Feature Phone,1057.08,107,4.3,2024-06-15 10:25:45.743084,Performant Lenovo Smartphones Feature Phone Lite. Interface intuitive. Idéal pour feature phone. Catégorie Smartphones.
567,LG Wearables Lunettes AR Plus,Wearables,Lunettes AR,747.93,299,4.3,2024-03-31 10:25:45.743084,Compact LG Wearables Lunettes AR Plus. Connectivité avancée. Idéal pour lunettes ar. Catégorie Wearables.
568,Samsung Accessoires Cable Plus,Accessoires,Cable,194.16,444,4.9,2024-02-22 10:25:45.743084,Puissant Samsung Accessoires Cable Plus. Design moderne. Idéal pour cable. Catégorie Accessoires.
569,LG Photo Appareil Photo Lite,Photo,Appareil Photo,1408.84,404,3.9,2024-05-02 10:25:45.743084,Innovant LG Photo Appareil Photo Lite. Longue autonomie. Idéal pour appareil photo. Catégorie Photo.
570,Acer Audio Soundbar Lite,Audio,Soundbar,410.35,6,4.9,2024-06-11 10:25:45.743084,Premium Acer Audio Soundbar Lite. Design moderne. Idéal pour soundbar. Catégorie Audio.
571,Acer Tablettes iPad Plus,Tablettes,iPad,521.23,127,4.7,2024-08-12 10:25:45.743084,Élégant Acer Tablettes iPad Plus. Haute performance. Idéal pour ipad. Catégorie Tablettes.
572,Xiaomi Smartphones iPhone Standard,Smartphones,iPhone,1370.59,352,4.6,2025-01-28 10:25:45.743084,Révolutionnaire Xiaomi Smartphones iPhone Standard. Haute performance. Idéal pour iphone. Catégorie Smartphones.
573,LG Tablettes Android Tablet Standard,Tablettes,Android Tablet,976.86,482,4.7,2024-12-27 10:25:45.743084,Performant LG Tablettes Android Tablet Standard. Longue autonomie. Idéal pour android tablet. Catégorie Tablettes.
574,Xiaomi Gaming Jeux Lite,Gaming,Jeux,333.06,266,4.4,2024-07-22 10:25:45.743084,Révolutionnaire Xiaomi Gaming Jeux Lite. Connectivité avancée. Idéal pour jeux. Catégorie Gaming.
575,Sony Audio Casque Bluetooth Plus,Audio,Casque Bluetooth,221.35,172,3.9,2025-06-30 10:25:45.743084,Polyvalent Sony Audio Casque Bluetooth Plus. Design moderne. Idéal pour casque bluetooth. Catégorie Audio.
576,Lenovo Smartphones iPhone Lite,Smartphones,iPhone,638.51,415,3.8,2024-01-01 10:25:45.743084,Innovant Lenovo Smartphones iPhone Lite. Connectivité avancée. Idéal pour iphone. Catégorie Smartphones.
577,Acer Gaming PC Gaming Pro,Gaming,PC Gaming,1613.33,213,4.8,2025-03-21 10:25:45.743084,Puissant Acer Gaming PC Gaming Pro. Design moderne. Idéal pour pc gaming. Catégorie Gaming.
578,Acer Ordinateurs Ultrabook Lite,Ordinateurs,Ultrabook,1525.71,246,4.6,2025-05-04 10:25:45.743084,Puissant Acer Ordinateurs Ultrabook Lite. Connectivité avancée. Idéal pour ultrabook. Catégorie Ordinateurs.
579,HP Photo Objectif Standard,Photo,Objectif,3517.57,105,3.8,2024-11-22 10:25:45.743084,Compact HP Photo Objectif Standard. Longue autonomie. Idéal pour objectif. Catégorie Photo.
580,Dell Accessoires Clavier Lite,Accessoires,Clavier,124.46,82,4.4,2024-02-28 10:25:45.743084,Élégant Dell Accessoires Clavier Lite. Haute performance. Idéal pour clavier. Catégorie Accessoires.
581,Asus Photo Appareil Photo Standard,Photo,Appareil Photo,4885.5,291,4.2,2024-09-24 10:25:45.743084,Révolutionnaire Asus Photo Appareil Photo Standard. Haute performance. Idéal pour appareil photo. Catégorie Photo.
582,Sony Smart Home Caméra Pro,Smart Home,Caméra,472.0,373,3.7,2025-05-16 10:25:45.743084,Puissant Sony Smart Home Caméra Pro. Design moderne. Idéal pour caméra. Catégorie Smart Home.
583,Apple Gaming Console Standard,Gaming,Console,969.86,420,4.3,2025-01-11 10:25:45.743084,Révolutionnaire Apple Gaming Console Standard. Interface intuitive. Idéal pour console. Catégorie Gaming.
584,Xiaomi Accessoires Housse Max,Accessoires,Housse,147.48,202,3.9,2025-03-05 10:25:45.743084,Premium Xiaomi Accessoires Housse Max. Connectivité avancée. Idéal pour housse. Catégorie Accessoires.
585,Samsung Smartphones Feature Phone Standard,Smartphones,Feature Phone,1278.3,40,3.6,2025-10-04 10:25:45.743084,Révolutionnaire Samsung Smartphones Feature Phone Standard. Longue autonomie. Idéal pour feature phone. Catégorie Smartphones.
586,Xiaomi Gaming Jeux Pro,Gaming,Jeux,1817.99,204,4.2,2024-07-14 10:25:45.743084,Innovant Xiaomi Gaming Jeux Pro. Longue autonomie. Idéal pour jeux. Catégorie Gaming.
587,Lenovo Accessoires Casque Standard,Accessoires,Casque,22.95,347,4.4,2024-08-15 10:25:45.743084,Élégant Lenovo Accessoires Casque Standard. Haute performance. Idéal pour casque. Catégorie Accessoires.
588,Dell Ordinateurs Workstation Lite,Ordinateurs,Workstation,1255.2,48,3.6,2024-04-01 10:25:45.743084,Innovant Dell Ordinateurs Workstation Lite. Design moderne. Idéal pour workstation. Catégorie Ordinateurs.
589,Asus Photo Drone Pro,Photo,Drone,1805.08,142,4.1,2024-11-10 10:25:45.743084,Révolutionnaire Asus Photo Drone Pro. Connectivité avancée. Idéal pour drone. Catégorie Photo.
590,Asus Smartphones Android Standard,Smartphones,Android,764.78,140,3.9,2025-03-05 10:25:45.743084,Élégant Asus Smartphones Android Standard. Longue autonomie. Idéal pour android. Catégorie Smartphones.
591,Samsung Ordinateurs Desktop Plus,Ordinateurs,Desktop,923.16,52,3.5,2024-11-15 10:25:45.743084,Performant Samsung Ordinateurs Desktop Plus. Interface intuitive. Idéal pour desktop. Catégorie Ordinateurs.
592,Xiaomi Wearables Bracelet Connecté Pro,Wearables,Bracelet Connecté,447.34,106,3.7,2024-09-15 10:25:45.743084,Performant Xiaomi Wearables Bracelet Connecté Pro. Interface intuitive. Idéal pour bracelet connecté. Catégorie Wearables.
593,Asus Accessoires Cable Standard,Accessoires,Cable,136.01,32,3.7,2023-11-26 10:25:45.743084,Polyvalent Asus Accessoires Cable Standard. Haute performance. Idéal pour cable. Catégorie Accessoires.
594,Dell Smartphones iPhone Standard,Smartphones,iPhone,846.57,199,3.8,2025-08-26 10:25:45.743084,Élégant Dell Smartphones iPhone Standard. Interface intuitive. Idéal pour iphone. Catégorie Smartphones.
595,Apple Photo Drone Max,Photo,Drone,3429.23,118,4.7,2025-07-17 10:25:45.743084,Compact Apple Photo Drone Max. Interface intuitive. Idéal pour drone. Catégorie Photo.
596,Asus Wearables Lunettes AR Pro,Wearables,Lunettes AR,146.51,287,4.2,2023-12-10 10:25:45.743084,Premium Asus Wearables Lunettes AR Pro. Connectivité avancée. Idéal pour lunettes ar. Catégorie Wearables.
597,Xiaomi Ordinateurs Workstation Lite,Ordinateurs,Workstation,2689.97,228,3.7,2025-09-13 10:25:45.743084,Puissant Xiaomi Ordinateurs Workstation Lite. Interface intuitive. Idéal pour workstation. Catégorie Ordinateurs.
598,Asus Photo Drone Lite,Photo,Drone,4713.63,117,3.7,2023-12-30 10:25:45.743084,Polyvalent Asus Photo Drone Lite. Interface intuitive. Idéal pour drone. Catégorie Photo.
599,Acer Gaming Manette Max,Gaming,Manette,1312.23,175,3.9,2025-09-22 10:25:45.743084,Performant Acer Gaming Manette Max. Design moderne. Idéal pour manette. Catégorie Gaming.
600,LG Smartphones Feature Phone Max,Smartphones,Feature Phone,1345.81,451,4.7,2024-07-07 10:25:45.743084,Innovant LG Smartphones Feature Phone Max. Interface intuitive. Idéal pour feature phone. Catégorie Smartphones.
601,Dell Accessoires Housse Max,Accessoires,Housse,34.97,184,4.0,2024-07-21 10:25:45.743084,Puissant Dell Accessoires Housse Max. Longue autonomie. Idéal pour housse. Catégorie Accessoires.
602,Lenovo Ordinateurs Desktop Pro,Ordinateurs,Desktop,2493.62,317,3.7,2025-05-23 10:25:45.743084,Puissant Lenovo Ordinateurs Desktop Pro. Interface intuitive. Idéal pour desktop. Catégorie Ordinateurs.
603,Acer Gaming PC Gaming Max,Gaming,PC Gaming,414.47,498,4.1,2024-12-02 10:25:45.743084,Performant Acer Gaming PC Gaming Max. Connectivité avancée. Idéal pour pc gaming. Catégorie Gaming.
604,Acer Gaming PC Gaming Max,Gaming,PC Gaming,934.42,337,4.3,2024-09-16 10:25:45.743084,Innovant Acer Gaming PC Gaming Max. Connectivité avancée. Idéal pour pc gaming. Catégorie Gaming.
605,Apple Ordinateurs Desktop Lite,Ordinateurs,Desktop,1309.55,214,3.5,2025-08-20 10:25:45.743084,Compact Apple Ordinateurs Desktop Lite. Interface intuitive. Idéal pour desktop. Catégorie Ordinateurs.
606,Acer Gaming Manette Plus,Gaming,Manette,1254.07,220,4.4,2024-11-10 10:25:45.743084,Performant Acer Gaming Manette Plus. Longue autonomie. Idéal pour manette. Catégorie Gaming.
607,Acer Gaming PC Gaming Pro,Gaming,PC Gaming,742.73,129,4.1,2024-03-08 10:25:45.743084,Élégant Acer Gaming PC Gaming Pro. Haute performance. Idéal pour pc gaming. Catégorie Gaming.
608,Dell Tablettes Android Tablet Standard,Tablettes,Android Tablet,819.18,332,3.5,2025-05-05 10:25:45.743084,Performant Dell Tablettes Android Tablet Standard. Interface intuitive. Idéal pour android tablet. Catégorie Tablettes.
609,Apple Photo Drone Max,Photo,Drone,2026.72,271,4.5,2024-07-04 10:25:45.743084,Performant Apple Photo Drone Max. Interface intuitive. Idéal pour drone. Catégorie Photo.
610,Xiaomi Ordinateurs Ultrabook Pro,Ordinateurs,Ultrabook,2651.98,245,4.6,2025-01-31 10:25:45.743084,Puissant Xiaomi Ordinateurs Ultrabook Pro. Interface intuitive. Idéal pour ultrabook. Catégorie Ordinateurs.
611,Lenovo Smart Home Éclairage Standard,Smart Home,Éclairage,335.25,122,4.4,2024-12-06 10:25:45.743084,Polyvalent Lenovo Smart Home Éclairage Standard. Design moderne. Idéal pour éclairage. Catégorie Smart Home.
612,Samsung Accessoires Souris Max,Accessoires,Souris,50.91,7,4.0,2023-11-13 10:25:45.743084,Innovant Samsung Accessoires Souris Max. Design moderne. Idéal pour souris. Catégorie Accessoires.
613,Dell Audio Casque Bluetooth Plus,Audio,Casque Bluetooth,187.98,402,4.3,2024-12-11 10:25:45.743084,Premium Dell Audio Casque Bluetooth Plus. Connectivité avancée. Idéal pour casque bluetooth. Catégorie Audio.
614,Acer Photo Objectif Max,Photo,Objectif,4282.88,415,4.1,2024-07-23 10:25:45.743084,Premium Acer Photo Objectif Max. Interface intuitive. Idéal pour objectif. Catégorie Photo.
615,Dell Audio Soundbar Max,Audio,Soundbar,211.65,66,4.6,2024-09-08 10:25:45.743084,Compact Dell Audio Soundbar Max. Connectivité avancée. Idéal pour soundbar. Catégorie Audio.
616,Apple Gaming Jeux Pro,Gaming,Jeux,1164.44,114,4.4,2024-02-05 10:25:45.743084,Compact Apple Gaming Jeux Pro. Connectivité avancée. Idéal pour jeux. Catégorie Gaming.
617,Acer Audio Casque Bluetooth Plus,Audio,Casque Bluetooth,335.0,368,3.6,2024-07-03 10:25:45.743084,Puissant Acer Audio Casque Bluetooth Plus. Longue autonomie. Idéal pour casque bluetooth. Catégorie Audio.
618,Acer Wearables Smartwatch Plus,Wearables,Smartwatch,343.47,287,4.5,2024-09-04 10:25:45.743084,Innovant Acer Wearables Smartwatch Plus. Connectivité avancée. Idéal pour smartwatch. Catégorie Wearables.
619,Xiaomi Audio Soundbar Max,Audio,Soundbar,168.17,104,4.5,2024-06-07 10:25:45.743084,Polyvalent Xiaomi Audio Soundbar Max. Connectivité avancée. Idéal pour soundbar. Catégorie Audio.
620,Lenovo Smartphones iPhone Max,Smartphones,iPhone,817.83,468,4.1,2024-04-17 10:25:45.743084,Puissant Lenovo Smartphones iPhone Max. Design moderne. Idéal pour iphone. Catégorie Smartphones.
621,HP Smart Home Caméra Lite,Smart Home,Caméra,146.7,24,4.8,2025-01-27 10:25:45.743084,Polyvalent HP Smart Home Caméra Lite. Connectivité avancée. Idéal pour caméra. Catégorie Smart Home.
622,Lenovo Photo Objectif Standard,Photo,Objectif,1635.79,52,4.8,2025-08-12 10:25:45.743084,Révolutionnaire Lenovo Photo Objectif Standard. Interface intuitive. Idéal pour objectif. Catégorie Photo.
623,Apple Photo Stabilisateur Max,Photo,Stabilisateur,591.77,246,3.8,2024-09-24 10:25:45.743084,Polyvalent Apple Photo Stabilisateur Max. Connectivité avancée. Idéal pour stabilisateur. Catégorie Photo.
624,Samsung Composants Processeur Plus,Composants,Processeur,642.74,336,4.9,2025-08-25 10:25:45.743084,Polyvalent Samsung Composants Processeur Plus. Connectivité avancée. Idéal pour processeur. Catégorie Composants.
625,Acer Ordinateurs Laptop Plus,Ordinateurs,Laptop,1301.76,280,4.2,2024-12-25 10:25:45.743084,Polyvalent Acer Ordinateurs Laptop Plus. Longue autonomie. Idéal pour laptop. Catégorie Ordinateurs.
626,Xiaomi Accessoires Souris Lite,Accessoires,Souris,192.75,32,4.6,2023-12-09 10:25:45.743084,Performant Xiaomi Accessoires Souris Lite. Design moderne. Idéal pour souris. Catégorie Accessoires.
627,LG Smartphones iPhone Plus,Smartphones,iPhone,966.65,286,4.7,2024-08-11 10:25:45.743084,Polyvalent LG Smartphones iPhone Plus. Design moderne. Idéal pour iphone. Catégorie Smartphones.
628,Xiaomi Audio Soundbar Plus,Audio,Soundbar,400.07,35,4.3,2024-01-26 10:25:45.743084,Puissant Xiaomi Audio Soundbar Plus. Haute performance. Idéal pour soundbar. Catégorie Audio.
629,HP Gaming Console Standard,Gaming,Console,281.68,342,4.1,2025-03-22 10:25:45.743084,Compact HP Gaming Console Standard. Haute performance. Idéal pour console. Catégorie Gaming.
630,Sony Smart Home Caméra Pro,Smart Home,Caméra,97.94,378,4.9,2025-03-01 10:25:45.743084,Élégant Sony Smart Home Caméra Pro. Interface intuitive. Idéal pour caméra. Catégorie Smart Home.
631,Dell Accessoires Casque Pro,Accessoires,Casque,164.76,238,3.8,2024-12-31 10:25:45.743084,Innovant Dell Accessoires Casque Pro. Design moderne. Idéal pour casque. Catégorie Accessoires.
632,Apple Gaming Jeux Plus,Gaming,Jeux,1322.39,491,3.9,2024-10-10 10:25:45.743084,Puissant Apple Gaming Jeux Plus. Connectivité avancée. Idéal pour jeux. Catégorie Gaming.
633,Xiaomi Smart Home Alarme Lite,Smart Home,Alarme,135.94,216,4.0,2025-01-10 10:25:45.743084,Révolutionnaire Xiaomi Smart Home Alarme Lite. Haute performance. Idéal pour alarme. Catégorie Smart Home.
634,Xiaomi Photo Appareil Photo Max,Photo,Appareil Photo,2202.54,176,4.8,2024-02-15 10:25:45.743084,Premium Xiaomi Photo Appareil Photo Max. Haute performance. Idéal pour appareil photo. Catégorie Photo.
635,Xiaomi Smartphones Feature Phone Standard,Smartphones,Feature Phone,900.27,43,4.9,2024-04-17 10:25:45.743084,Élégant Xiaomi Smartphones Feature Phone Standard. Interface intuitive. Idéal pour feature phone. Catégorie Smartphones.
636,HP Audio Casque Bluetooth Lite,Audio,Casque Bluetooth,426.5,303,3.8,2024-07-29 10:25:45.743084,Performant HP Audio Casque Bluetooth Lite. Interface intuitive. Idéal pour casque bluetooth. Catégorie Audio.
637,LG Smart Home Éclairage Lite,Smart Home,Éclairage,77.19,157,4.8,2025-04-06 10:25:45.743084,Compact LG Smart Home Éclairage Lite. Haute performance. Idéal pour éclairage. Catégorie Smart Home.
638,Dell Composants SSD Plus,Composants,SSD,1213.61,268,3.9,2024-01-11 10:25:45.743084,Premium Dell Composants SSD Plus. Interface intuitive. Idéal pour ssd. Catégorie Composants.
639,Asus Audio Écouteurs Lite,Audio,Écouteurs,367.01,170,5.0,2024-10-30 10:25:45.743084,Performant Asus Audio Écouteurs Lite. Haute performance. Idéal pour écouteurs. Catégorie Audio.
640,Apple Wearables Lunettes AR Max,Wearables,Lunettes AR,784.52,494,4.4,2025-01-08 10:25:45.743084,Performant Apple Wearables Lunettes AR Max. Interface intuitive. Idéal pour lunettes ar. Catégorie Wearables.
641,Xiaomi Smartphones Feature Phone Lite,Smartphones,Feature Phone,1249.31,220,3.5,2025-07-13 10:25:45.743084,Performant Xiaomi Smartphones Feature Phone Lite. Longue autonomie. Idéal pour feature phone. Catégorie Smartphones.
